tense,dataset,theme,num_words,structure,audio_filename,sentence_id,numerosity,sentence
past,naturalistic,shopping,10,independent,nat_00457.wav,nat_00457,singular,Did the bakery offer any discounts when you visited yesterday?
future,naturalistic,food,7,simple,nat_00777.wav,nat_00777,singular,The bread won't have baked correctly tomorrow
future,naturalistic,emotion,10,preposition,nat_02129.wav,nat_02129,singular,The gift under the tree will not make her happy
present,naturalistic,basic,6,simple,nat_02036.wav,nat_02036,singular,Please don't leave the door open
future,naturalistic,relationship,11,preposition,nat_02029.wav,nat_02029,plural,Will the friends on that street not meet up next weekend?
past,naturalistic,basic,8,simple,nat_00054.wav,nat_00054,singular,Don't say he didn't attend the party yesterday
past,naturalistic,work,7,simple,nat_01676.wav,nat_01676,plural,Check the assignments you completed last week
future,naturalistic,humanity,8,preposition,nat_00643.wav,nat_00643,singular,She will present her research during the conference
past,naturalistic,weather,7,simple,nat_01710.wav,nat_01710,singular,Has the frost arrived early this year?
future,naturalistic,relationship,11,independent,nat_00677.wav,nat_00677,plural,Will they need help because everyone will be very busy tomorrow?
future,naturalistic,relationship,10,preposition,nat_00221.wav,nat_00221,singular,Your friend will not leave for the meeting after lunch
future,naturalistic,art,8,simple,nat_00113.wav,nat_00113,singular,Her sketch will not appear in the exhibit
future,naturalistic,relationship,9,simple,nat_01121.wav,nat_01121,singular,Her mother will bake a cake for the party
present,naturalistic,food,7,preposition,nat_01368.wav,nat_01368,plural,Don't forget the vegetables in your diet
present,naturalistic,nature,8,simple,nat_01131.wav,nat_01131,plural,Don't these flowers bloom in the winter season?
past,naturalistic,housing,8,simple,nat_00174.wav,nat_00174,singular,Don't forget the walls were never painted properly
present,naturalistic,sport,9,preposition,nat_00974.wav,nat_00974,singular,Do not run on the track beside the field
present,naturalistic,relationship,5,simple,nat_00589.wav,nat_00589,singular,Is her friend visiting today?
future,naturalistic,nature,11,independent,nat_01606.wav,nat_01606,singular,The desert will stay hot and the nights will be cold
future,naturalistic,basic,9,preposition,nat_01738.wav,nat_01738,plural,Friends will meet at the coffee shop after work
future,naturalistic,nature,11,preposition,nat_00018.wav,nat_00018,plural,Are those animals across the field never going to return here?
future,naturalistic,sport,10,independent,nat_00423.wav,nat_00423,plural,Will teams not train because they will not play tomorrow?
present,naturalistic,basic,7,simple,nat_01578.wav,nat_01578,plural,Your friends often visit on Friday nights
future,naturalistic,shopping,9,dependent,nat_00285.wav,nat_00285,singular,What time will the coffee shop open tomorrow morning?
future,naturalistic,basic,7,simple,nat_02040.wav,nat_02040,singular,Is your mother planning to visit soon?
future,naturalistic,weather,9,preposition,nat_00428.wav,nat_00428,singular,Please don't plant flowers in the frost this spring
future,naturalistic,basic,7,simple,nat_01684.wav,nat_01684,singular,Won't the coffee be ready by morning?
present,naturalistic,shopping,7,simple,nat_00932.wav,nat_00932,singular,Does this store have any discounts today?
past,naturalistic,art,10,preposition,nat_00669.wav,nat_00669,plural,Did the artists in the gallery create those paintings yesterday?
past,naturalistic,shopping,10,preposition,nat_00031.wav,nat_00031,plural,Were all those groceries bought at a low price yesterday?
present,naturalistic,emotion,8,dependent,nat_01622.wav,nat_01622,singular,I don't feel the happiness that I expected
past,naturalistic,humanity,9,dependent,nat_00722.wav,nat_00722,singular,The book you wanted was not on the shelf
future,naturalistic,basic,7,simple,nat_01491.wav,nat_01491,singular,You will not bring any guests tomorrow
present,naturalistic,transport,5,simple,nat_01272.wav,nat_01272,singular,Don't forget the bus schedule
past,naturalistic,shopping,7,simple,nat_00214.wav,nat_00214,plural,Didn't those products sell well last year?
past,naturalistic,relationship,9,simple,nat_01054.wav,nat_01054,plural,Let them know they found happiness with their children
present,naturalistic,relationship,10,independent,nat_01452.wav,nat_01452,singular,He does not care why she does not visit often
future,naturalistic,shopping,9,simple,nat_00987.wav,nat_00987,plural,Will those deals be available for everyone next week?
present,naturalistic,nature,8,simple,nat_00326.wav,nat_00326,singular,The bird does not fly in the rain
present,naturalistic,relationship,7,simple,nat_00560.wav,nat_00560,plural,Make time for family game nights regularly
future,naturalistic,relationship,11,preposition,nat_02009.wav,nat_02009,singular,Will his brother not be among friends at the beach today?
future,naturalistic,health,9,preposition,nat_00700.wav,nat_00700,plural,They will exercise at the gym for better health
present,naturalistic,work,9,preposition,nat_00931.wav,nat_00931,singular,Please don't write on the wall near the door
past,naturalistic,relationship,10,preposition,nat_01323.wav,nat_01323,singular,His father wasn't happy about the trip to the beach
past,naturalistic,relationship,9,preposition,nat_00341.wav,nat_00341,plural,Bring books from the shelf to the living room
future,naturalistic,transport,9,preposition,nat_00629.wav,nat_00629,plural,The trains from the city will leave every evening
future,naturalistic,art,10,dependent,nat_00147.wav,nat_00147,singular,The artist will not finish the sculpture that she started
present,naturalistic,shopping,11,dependent,nat_01331.wav,nat_01331,plural,The toys displayed on the shelf are what the children want
future,naturalistic,relationship,7,simple,nat_00360.wav,nat_00360,plural,Many children will not attend the party
future,naturalistic,art,7,simple,nat_00083.wav,nat_00083,plural,Do not paint in the dark tomorrow
present,naturalistic,shopping,9,independent,nat_01557.wav,nat_01557,plural,Remember to check online and visit the store later
present,naturalistic,shopping,10,preposition,nat_00048.wav,nat_00048,singular,Does the market on the corner have fresh produce today?
present,naturalistic,relationship,6,simple,nat_00468.wav,nat_00468,plural,Are your parents home right now?
future,naturalistic,relationship,11,dependent,nat_00881.wav,nat_00881,plural,Tell your brothers not to take the tools which are broken
present,naturalistic,art,10,dependent,nat_00155.wav,nat_00155,plural,Do the artists who inspire you not create sculptures anymore?
present,naturalistic,work,6,simple,nat_00962.wav,nat_00962,singular,She cannot skip this important lecture
future,naturalistic,nature,9,preposition,nat_01963.wav,nat_01963,singular,The sun behind the mountains will not set soon
future,naturalistic,health,9,preposition,nat_01335.wav,nat_01335,plural,You should not skip breakfast before a long day
present,naturalistic,nature,8,dependent,nat_01566.wav,nat_01566,singular,Remember that a desert doesn't receive much rain
future,naturalistic,relationship,10,dependent,nat_01338.wav,nat_01338,plural,Our children will enjoy the toys which we purchase today
present,naturalistic,health,10,independent,nat_01811.wav,nat_01811,singular,Please eat more vegetables and drink water for better health
past,naturalistic,food,11,dependent,nat_00855.wav,nat_00855,singular,What made him think the salad that he prepared was enough?
future,naturalistic,shopping,8,preposition,nat_00500.wav,nat_00500,singular,Don't look at the price on that shelf
past,naturalistic,sport,11,independent,nat_01964.wav,nat_01964,singular,Had the match started while did you arrive late to it?
past,naturalistic,work,10,simple,nat_00179.wav,nat_00179,plural,Didn't the kids complete their school tasks over the weekend?
future,naturalistic,work,7,simple,nat_01406.wav,nat_01406,singular,You won't attend the meeting later today
future,naturalistic,science,9,dependent,nat_01954.wav,nat_01954,plural,Those computers will not function if they lack power
future,naturalistic,transport,10,preposition,nat_01744.wav,nat_01744,singular,The road trip through the mountains will happen next summer
past,naturalistic,work,8,simple,nat_00178.wav,nat_00178,plural,Didn't the workers have training sessions last week?
present,naturalistic,relationship,8,simple,nat_01290.wav,nat_01290,plural,Don't forget to share your snacks at school
future,naturalistic,emotion,9,independent,nat_01569.wav,nat_01569,singular,He won't feel joy if she won't smile tomorrow
past,naturalistic,science,10,preposition,nat_00938.wav,nat_00938,singular,This device from the store did not function as expected
present,naturalistic,relationship,9,preposition,nat_01800.wav,nat_01800,plural,Her parents are not coming to our party tonight
past,naturalistic,housing,8,simple,nat_00528.wav,nat_00528,singular,I hadn't bought any new furniture last month
future,naturalistic,basic,10,dependent,nat_00346.wav,nat_00346,plural,Find the book that will help you with the project
past,naturalistic,shopping,6,dependent,nat_01551.wav,nat_01551,plural,Find the offers that ended yesterday
past,naturalistic,health,6,simple,nat_02111.wav,nat_02111,singular,She wasn't feeling well last week
future,naturalistic,work,11,preposition,nat_01017.wav,nat_01017,singular,Will the manager not attend the meeting in the office tomorrow?
past,naturalistic,weather,5,simple,nat_01709.wav,nat_01709,singular,Was there a storm yesterday?
past,naturalistic,nature,10,dependent,nat_00385.wav,nat_00385,plural,The clouds did not form while the sky stayed clear
present,naturalistic,food,5,simple,nat_01075.wav,nat_01075,plural,Are the fruits fresh today?
future,naturalistic,transport,10,preposition,nat_01747.wav,nat_01747,singular,The ticket on your desk will be used later today
future,naturalistic,weather,11,preposition,nat_00601.wav,nat_00601,plural,Are the days in summer going to be longer this year?
future,naturalistic,basic,7,simple,nat_01490.wav,nat_01490,singular,Do not turn off the lights yet
present,naturalistic,basic,9,dependent,nat_00243.wav,nat_00243,singular,Do not buy anything unless it is necessary now
past,naturalistic,basic,10,preposition,nat_01233.wav,nat_01233,plural,Do not place your bags on the chairs beside us
future,naturalistic,basic,10,preposition,nat_00802.wav,nat_00802,plural,Will the stars in the sky not shine bright tonight?
past,naturalistic,science,9,preposition,nat_00936.wav,nat_00936,singular,The computer in your office was not working yesterday
present,naturalistic,work,6,simple,nat_01193.wav,nat_01193,singular,That student works hard on assignments
future,naturalistic,nature,10,dependent,nat_01646.wav,nat_01646,plural,Will the animals that live here not find water tomorrow?
present,naturalistic,work,9,preposition,nat_00312.wav,nat_00312,singular,Is the person in the office not available today?
future,naturalistic,basic,9,dependent,nat_00435.wav,nat_00435,plural,Will all passengers who travel often stay overnight here?
past,naturalistic,nature,9,simple,nat_02081.wav,nat_02081,plural,These hills were not visible from the road before
future,naturalistic,relationship,11,dependent,nat_00136.wav,nat_00136,plural,Their children will not visit the park where they usually play
present,naturalistic,sport,12,preposition,nat_00308.wav,nat_00308,singular,Does the gym with all the equipment open early in the morning?
future,naturalistic,work,8,simple,nat_00968.wav,nat_00968,singular,Will she not attend the workshop this weekend?
past,naturalistic,nature,11,independent,nat_00430.wav,nat_00430,singular,Did the stars shine brightly because the sky was clear tonight?
future,naturalistic,shopping,11,preposition,nat_00660.wav,nat_00660,singular,Shall the bakery in town reduce their bread prices next morning?
past,naturalistic,basic,8,simple,nat_01100.wav,nat_01100,plural,The trains hadn't arrived on time earlier today
present,naturalistic,basic,4,simple,nat_01660.wav,nat_01660,plural,We don't see them
present,naturalistic,housing,9,dependent,nat_00370.wav,nat_00370,plural,The chairs in the living room are not comfortable
future,naturalistic,emotion,8,simple,nat_00566.wav,nat_00566,singular,Is she not going to feel happy tomorrow?
future,naturalistic,sport,9,dependent,nat_00949.wav,nat_00949,singular,Will the player who trains hard not compete tomorrow?
past,naturalistic,sport,10,preposition,nat_01210.wav,nat_01210,plural,Did the players not train at the gym last week?
future,naturalistic,relationship,7,simple,nat_01118.wav,nat_01118,singular,My brother will join the team soon
past,naturalistic,work,9,simple,nat_00824.wav,nat_00824,singular,Don’t think he had prepared his presentation well enough
future,naturalistic,relationship,8,preposition,nat_00181.wav,nat_00181,plural,My brothers will not arrive before the party
future,naturalistic,housing,9,simple,nat_01057.wav,nat_01057,singular,Isn't a new carpet going to look great here?
future,naturalistic,nature,7,simple,nat_00621.wav,nat_00621,singular,Your garden will bloom beautifully in spring
past,naturalistic,basic,10,dependent,nat_01025.wav,nat_01025,plural,Did your cousins who stayed overnight enjoy their breakfast here?
past,naturalistic,relationship,10,preposition,nat_01326.wav,nat_01326,singular,Her brother had not run along the river with us
past,naturalistic,relationship,9,preposition,nat_01160.wav,nat_01160,plural,Don't walk away from their advice in difficult times
past,naturalistic,weather,7,independent,nat_00813.wav,nat_00813,singular,He felt cold because winter had arrived
present,naturalistic,basic,7,preposition,nat_01926.wav,nat_01926,singular,Her book is not on the table
future,naturalistic,food,8,preposition,nat_00406.wav,nat_00406,plural,Don't leave out the vegetables in your meals
past,naturalistic,shopping,11,simple,nat_00778.wav,nat_00778,singular,Did he try the new coffee shop on the corner yesterday?
future,naturalistic,work,8,simple,nat_01720.wav,nat_01720,plural,You mustn't arrive after the meeting has started
past,naturalistic,emotion,10,independent,nat_00296.wav,nat_00296,singular,Did you feel alone or did someone support you yesterday?
future,naturalistic,nature,10,preposition,nat_01525.wav,nat_01525,singular,A fish in the lake will find more food soon
future,naturalistic,basic,8,dependent,nat_00461.wav,nat_00461,plural,The guests won't stay longer than they plan
present,naturalistic,shopping,10,dependent,nat_01456.wav,nat_01456,plural,Are the shoes that you want not on sale today?
present,naturalistic,humanity,7,dependent,nat_01310.wav,nat_01310,plural,The books you wanted aren't available today
future,naturalistic,health,8,simple,nat_00904.wav,nat_00904,plural,Will they try to eat healthier next year?
present,naturalistic,basic,10,preposition,nat_00377.wav,nat_00377,plural,These stories from your friends don't interest me at all
future,naturalistic,work,8,simple,nat_00798.wav,nat_00798,singular,The student will finish the project by Friday
past,naturalistic,relationship,8,simple,nat_01231.wav,nat_01231,plural,Their friends weren't prepared for the exam yesterday
past,naturalistic,humanity,8,simple,nat_00105.wav,nat_00105,plural,Please don't assume those traditions were always practiced
past,naturalistic,science,7,simple,nat_00126.wav,nat_00126,plural,Do not assume those results were accurate
present,naturalistic,shopping,6,simple,nat_00839.wav,nat_00839,plural,Those gadgets sell quickly every season
future,naturalistic,relationship,10,preposition,nat_02048.wav,nat_02048,singular,The child will walk to the park with her mother
future,naturalistic,work,10,preposition,nat_00887.wav,nat_00887,plural,You must not start classes without all students present today
future,naturalistic,nature,7,simple,nat_01375.wav,nat_01375,singular,Isn't the sun going to shine tomorrow?
future,naturalistic,weather,9,preposition,nat_02088.wav,nat_02088,plural,They shouldn't play outside in the heat of summer
future,naturalistic,food,5,simple,nat_01007.wav,nat_01007,singular,Will she cook dinner tomorrow?
present,naturalistic,emotion,6,simple,nat_00355.wav,nat_00355,singular,She doesn't fear the dark anymore
past,naturalistic,shopping,7,simple,nat_01673.wav,nat_01673,singular,You were shopping for groceries earlier today
present,naturalistic,transport,10,preposition,nat_01797.wav,nat_01797,singular,Is the ticket for the morning train on sale today?
present,naturalistic,basic,9,dependent,nat_00682.wav,nat_00682,plural,Those chairs by the window are comfortable for guests
present,naturalistic,food,5,simple,nat_01711.wav,nat_01711,singular,My brother isn't eating dessert
past,naturalistic,housing,6,simple,nat_02103.wav,nat_02103,plural,Were those walls not painted before?
present,naturalistic,work,11,preposition,nat_01164.wav,nat_01164,plural,You must share your notes with the students after the class
present,naturalistic,transport,9,independent,nat_01967.wav,nat_01967,singular,This bike does not function while it's being repaired
future,naturalistic,shopping,8,simple,nat_00984.wav,nat_00984,plural,Are the prices going to drop next week?
future,naturalistic,transport,10,simple,nat_00209.wav,nat_00209,plural,Will they not find any tickets for the train tomorrow?
present,naturalistic,emotion,9,dependent,nat_01610.wav,nat_01610,plural,Why aren't friends who understand my fear ever here?
future,naturalistic,shopping,11,dependent,nat_01078.wav,nat_01078,plural,The discounts they apply will interest those who wait for sales
present,naturalistic,weather,7,simple,nat_00140.wav,nat_00140,singular,The flowers don't bloom until spring arrives
future,naturalistic,health,12,preposition,nat_01605.wav,nat_01605,plural,Your exercises will not take place in the evening at the gym
present,naturalistic,emotion,9,preposition,nat_01494.wav,nat_01494,singular,The book by my bed doesn't calm me anymore
present,naturalistic,relationship,10,dependent,nat_01185.wav,nat_01185,plural,Are the friends who visit frequently not coming this time?
future,naturalistic,basic,11,preposition,nat_01753.wav,nat_01753,plural,Will they not join us for a walk in the evening?
present,naturalistic,relationship,11,independent,nat_01451.wav,nat_01451,singular,She cannot play with you nor does she want to try
past,naturalistic,housing,11,independent,nat_01793.wav,nat_01793,plural,The chairs weren't comfortable so you didn't purchase them at all
future,naturalistic,transport,7,simple,nat_01992.wav,nat_01992,singular,His brother will drive to the city
future,naturalistic,weather,9,preposition,nat_00711.wav,nat_00711,plural,The trees by the beach won't grow in winter
past,naturalistic,shopping,11,independent,nat_01055.wav,nat_01055,plural,Those stores did not offer discounts nor did they have sales
past,naturalistic,shopping,7,preposition,nat_01870.wav,nat_01870,plural,Don't choose items over those broken shelves
future,naturalistic,basic,6,simple,nat_00010.wav,nat_00010,singular,The sun will not shine tomorrow
present,naturalistic,nature,11,dependent,nat_01255.wav,nat_01255,plural,Aren't the stars which shine at night not easily visible today?
future,naturalistic,health,9,simple,nat_01548.wav,nat_01548,singular,Is the doctor not going to see her soon?
present,naturalistic,health,6,simple,nat_00754.wav,nat_00754,singular,Isn't your mental health better now?
future,naturalistic,sport,10,preposition,nat_00626.wav,nat_00626,singular,A coach will not be available during every training session
future,naturalistic,housing,8,preposition,nat_01245.wav,nat_01245,plural,You must never place furniture near the door
past,naturalistic,sport,7,preposition,nat_00129.wav,nat_00129,singular,Do not run behind the track today
present,naturalistic,basic,10,dependent,nat_00843.wav,nat_00843,plural,Your shoes that are by the door aren't very clean
past,naturalistic,relationship,6,simple,nat_00323.wav,nat_00323,plural,Were your children playing outside yesterday?
present,naturalistic,shopping,10,dependent,nat_01457.wav,nat_01457,plural,Aren't those books on the shelf not on discount today?
present,naturalistic,weather,6,simple,nat_00014.wav,nat_00014,plural,Will the temperatures drop again tonight?
past,naturalistic,nature,10,preposition,nat_01492.wav,nat_01492,singular,Did the tree by the river not grow last year?
past,naturalistic,shopping,9,simple,nat_00215.wav,nat_00215,plural,Had those items not sold out quickly last month?
future,naturalistic,basic,7,simple,nat_01489.wav,nat_01489,singular,You will not wear those shoes tomorrow
future,naturalistic,emotion,10,preposition,nat_01501.wav,nat_01501,singular,She will feel calm on the beach in the morning
future,naturalistic,basic,9,preposition,nat_01742.wav,nat_01742,plural,The tourists will explore around the city next week
present,naturalistic,work,8,simple,nat_00864.wav,nat_00864,singular,Is the teacher not coming to class today?
past,naturalistic,housing,10,preposition,nat_00516.wav,nat_00516,plural,Were these books from the study room sold last year?
past,naturalistic,work,10,preposition,nat_00597.wav,nat_00597,singular,The student didn't study for the exam in the library
future,naturalistic,basic,9,independent,nat_00195.wav,nat_00195,plural,Bring snacks nor should you forget to bring drinks
past,naturalistic,art,9,simple,nat_00288.wav,nat_00288,plural,Were the musicians playing their best songs that night?
future,naturalistic,sport,11,dependent,nat_00950.wav,nat_00950,singular,Will the team whose coach is late not be practicing tonight?
future,naturalistic,sport,8,simple,nat_01319.wav,nat_01319,singular,Will she not participate in the race tomorrow?
future,naturalistic,relationship,9,simple,nat_01538.wav,nat_01538,plural,Will your grandparents create new family traditions next year?
future,naturalistic,sport,8,preposition,nat_00549.wav,nat_00549,plural,Gather your equipment for the tournament tomorrow morning
future,naturalistic,nature,9,preposition,nat_00156.wav,nat_00156,singular,You won't plant any trees in this field later
future,naturalistic,food,10,dependent,nat_00419.wav,nat_00419,singular,The cake will be baked by the time you arrive
future,naturalistic,basic,9,simple,nat_00922.wav,nat_00922,plural,Will the teachers not be attending the meeting tomorrow?
future,naturalistic,food,9,simple,nat_00477.wav,nat_00477,singular,Will the bread not be ready by lunch tomorrow?
present,naturalistic,weather,6,simple,nat_01182.wav,nat_01182,plural,Don't leave windows open in storms
past,naturalistic,nature,6,simple,nat_00553.wav,nat_00553,singular,This desert was not hot today
present,naturalistic,nature,5,simple,nat_00390.wav,nat_00390,singular,That bird doesn't sing loudly
past,naturalistic,basic,9,independent,nat_00578.wav,nat_00578,singular,The store was not open while I was there
past,naturalistic,art,10,independent,nat_02104.wav,nat_02104,singular,Do not paint the wall for it was not dry
present,naturalistic,transport,9,dependent,nat_01178.wav,nat_01178,singular,Why isn't the ferry that he wanted running today?
past,naturalistic,basic,9,dependent,nat_01828.wav,nat_01828,plural,Tell stories to guests after they finished their meal
past,naturalistic,work,8,simple,nat_00820.wav,nat_00820,singular,Do not think he attended the lecture yesterday
future,naturalistic,food,8,dependent,nat_02032.wav,nat_02032,singular,Do not prepare pasta that nobody will eat
present,naturalistic,emotion,7,preposition,nat_01006.wav,nat_01006,plural,Let happiness bloom inside the room often
present,naturalistic,emotion,8,preposition,nat_01173.wav,nat_01173,plural,The children in the park aren't feeling sad
present,naturalistic,nature,11,preposition,nat_00664.wav,nat_00664,plural,Are the stars visible in the clear sky above us tonight?
past,naturalistic,work,8,simple,nat_01677.wav,nat_01677,plural,Share the feedback you received from your colleagues
future,naturalistic,food,10,dependent,nat_00142.wav,nat_00142,plural,The people visiting tomorrow will love the soup you made
future,naturalistic,transport,8,simple,nat_01691.wav,nat_01691,singular,The car won't start in this cold weather
future,naturalistic,relationship,11,independent,nat_01320.wav,nat_01320,singular,Will your father watch the game or will he miss it?
future,naturalistic,food,9,dependent,nat_00421.wav,nat_00421,singular,She will grow vegetables in the garden next year
future,naturalistic,basic,10,preposition,nat_00799.wav,nat_00799,plural,Will the children in the park not be playing tomorrow?
past,naturalistic,health,7,simple,nat_00615.wav,nat_00615,singular,Did you experience more energy last week?
present,naturalistic,sport,5,simple,nat_00295.wav,nat_00295,singular,Study the game rules thoroughly
present,naturalistic,work,6,simple,nat_00401.wav,nat_00401,singular,I do not enjoy this class
past,naturalistic,humanity,11,preposition,nat_00088.wav,nat_00088,plural,Please don't buy tickets without discounts at the museum last Friday
present,naturalistic,basic,7,simple,nat_02037.wav,nat_02037,singular,You should not wear those shoes here
present,naturalistic,shopping,6,simple,nat_02098.wav,nat_02098,plural,Our discounts don't apply to electronics
past,naturalistic,sport,7,preposition,nat_00131.wav,nat_00131,singular,Don't train against the wall any longer
past,naturalistic,relationship,7,simple,nat_01132.wav,nat_01132,singular,My cousin visited our grandparents last weekend
future,naturalistic,relationship,11,preposition,nat_01765.wav,nat_01765,plural,Will the children in the park play with their friends tomorrow?
present,naturalistic,health,9,preposition,nat_01718.wav,nat_01718,singular,Do not forget to exercise along the river path
future,naturalistic,nature,8,simple,nat_01671.wav,nat_01671,singular,This river will not dry up next summer
present,naturalistic,shopping,8,preposition,nat_00724.wav,nat_00724,singular,Don't shop for vegetables in the morning market
