tense,dataset,theme,num_words,structure,audio_filename,sentence_id,numerosity,sentence
past,controlled,shopping,9,standard_object_a,ctrl_00293.wav,ctrl_00293,singular,The purchaser that everyone knows quickly purchased the article.
past,controlled,shopping,9,standard_object_b,ctrl_00294.wav,ctrl_00294,singular,The eager purchaser that everyone knows bought the item.
past,controlled,shopping,10,standard_object_c,ctrl_00295.wav,ctrl_00295,singular,The eager purchaser that everyone knows swiftly purchased the product.
past,controlled,shopping,12,nested,ctrl_00296.wav,ctrl_00296,singular,The purchaser who called the manager that was polite purchased the item.
past,controlled,shopping,13,nested_a,ctrl_00297.wav,ctrl_00297,singular,The buyer who called the manager that was courteous quickly bought the product.
past,controlled,shopping,13,nested_b,ctrl_00298.wav,ctrl_00298,singular,The enthusiastic buyer who called the manager that was polite purchased the item.
past,controlled,shopping,14,nested_c,ctrl_00299.wav,ctrl_00299,singular,The enthusiastic purchaser who called the manager that was polite quickly purchased the product.
present,controlled,health,3,baseline,ctrl_00300.wav,ctrl_00300,singular,The counselor hears.
present,controlled,health,4,baseline_a,ctrl_00301.wav,ctrl_00301,singular,The therapist closely listens.
present,controlled,health,4,baseline_b,ctrl_00302.wav,ctrl_00302,singular,The empathetic therapist listens.
present,controlled,health,5,baseline_c,ctrl_00303.wav,ctrl_00303,singular,The empathetic therapist attentively hears.
present,controlled,health,6,control,ctrl_00304.wav,ctrl_00304,singular,The therapist in the office listens.
present,controlled,health,7,control_a,ctrl_00305.wav,ctrl_00305,singular,The therapist in the clinic attentively listens.
present,controlled,health,7,control_b,ctrl_00306.wav,ctrl_00306,singular,The compassionate counselor in the office listens.
present,controlled,health,8,control_c,ctrl_00307.wav,ctrl_00307,singular,The compassionate therapist in the office closely listens.
present,controlled,health,5,standard_subject,ctrl_00308.wav,ctrl_00308,singular,The counselor who cares listens.
present,controlled,health,6,standard_subject_a,ctrl_00309.wav,ctrl_00309,singular,The therapist who tends attentively hears.
present,controlled,health,6,standard_subject_b,ctrl_00310.wav,ctrl_00310,singular,The empathetic therapist who concerns listens.
present,controlled,health,7,standard_subject_c,ctrl_00311.wav,ctrl_00311,singular,The empathetic therapist who cares attentively listens.
present,controlled,health,6,standard_object,ctrl_00312.wav,ctrl_00312,singular,The counselor that customers rely hears.
present,controlled,health,7,standard_object_a,ctrl_00313.wav,ctrl_00313,singular,The therapist that clients rely attentively listens.
present,controlled,health,7,standard_object_b,ctrl_00314.wav,ctrl_00314,singular,The empathetic counselor that clients rely listens.
present,controlled,health,8,standard_object_c,ctrl_00315.wav,ctrl_00315,singular,The empathetic therapist that patients trust carefully listens.
present,controlled,health,10,nested,ctrl_00316.wav,ctrl_00316,singular,The counselor who examined the case that was private hears.
present,controlled,health,11,nested_a,ctrl_00317.wav,ctrl_00317,singular,The counselor who examined the case that was private carefully hears.
present,controlled,health,11,nested_b,ctrl_00318.wav,ctrl_00318,singular,The empathetic counselor who reviewed the case that was confidential listens.
present,controlled,health,12,nested_c,ctrl_00319.wav,ctrl_00319,singular,The compassionate counselor who analyzed the situation that was confidential attentively listens.
present,controlled,housing,4,baseline,ctrl_00320.wav,ctrl_00320,singular,The couch needs fix.
present,controlled,housing,5,baseline_a,ctrl_00321.wav,ctrl_00321,singular,The sofa urgently needs mending.
present,controlled,housing,5,baseline_b,ctrl_00322.wav,ctrl_00322,singular,The old sofa requires fix.
present,controlled,housing,6,baseline_c,ctrl_00323.wav,ctrl_00323,singular,The ancient sofa immediately needs repair.
present,controlled,housing,8,control,ctrl_00324.wav,ctrl_00324,singular,The couch in the living room needs fix.
present,controlled,housing,9,control_a,ctrl_00325.wav,ctrl_00325,singular,The sofa in the living room urgently needs repair.
present,controlled,housing,9,control_b,ctrl_00326.wav,ctrl_00326,singular,The old couch in the living room needs fix.
present,controlled,housing,10,control_c,ctrl_00327.wav,ctrl_00327,singular,The old couch in the living room urgently needs repair.
present,controlled,housing,7,standard_subject,ctrl_00328.wav,ctrl_00328,singular,The sofa that I bought needs repair.
present,controlled,housing,8,standard_subject_a,ctrl_00329.wav,ctrl_00329,singular,The couch that I purchased immediately needs fix.
present,controlled,housing,8,standard_subject_b,ctrl_00330.wav,ctrl_00330,singular,The old sofa that I bought requires repair.
present,controlled,housing,9,standard_subject_c,ctrl_00331.wav,ctrl_00331,singular,The aged sofa that I bought urgently requires repair.
present,controlled,housing,8,standard_object,ctrl_00332.wav,ctrl_00332,singular,The sofa which my friend recommended needs fix.
present,controlled,housing,9,standard_object_a,ctrl_00333.wav,ctrl_00333,singular,The couch which my friend suggested urgently requires fix.
present,controlled,housing,9,standard_object_b,ctrl_00334.wav,ctrl_00334,singular,The old sofa which my buddy recommended needs repair.
present,controlled,housing,10,standard_object_c,ctrl_00335.wav,ctrl_00335,singular,The ancient couch which my friend endorsed urgently requires fix.
present,controlled,housing,11,nested,ctrl_00336.wav,ctrl_00336,singular,The couch that arrived yesterday which I ordered online needs mending.
present,controlled,housing,12,nested_a,ctrl_00337.wav,ctrl_00337,singular,The couch that arrived yesterday which I purchased online urgently needs repair.
present,controlled,housing,12,nested_b,ctrl_00338.wav,ctrl_00338,singular,The ancient sofa that arrived recently which I ordered online needs repair.
present,controlled,housing,13,nested_c,ctrl_00339.wav,ctrl_00339,singular,The old sofa that arrived yesterday which I ordered online urgently needs repair.
past,controlled,nature,2,baseline,ctrl_00340.wav,ctrl_00340,plural,Birds warbled.
past,controlled,nature,3,baseline_a,ctrl_00341.wav,ctrl_00341,plural,Birds loudly warbled.
past,controlled,nature,3,baseline_b,ctrl_00342.wav,ctrl_00342,plural,Wild birds sang.
past,controlled,nature,4,baseline_c,ctrl_00343.wav,ctrl_00343,plural,Untamed fowl noisily sang.
past,controlled,nature,5,control,ctrl_00344.wav,ctrl_00344,plural,Birds in the trees sang.
past,controlled,nature,6,control_a,ctrl_00345.wav,ctrl_00345,plural,Birds in the trees loudly chirped.
past,controlled,nature,6,control_b,ctrl_00346.wav,ctrl_00346,plural,Wild birds in the trees warbled.
past,controlled,nature,7,control_c,ctrl_00347.wav,ctrl_00347,plural,Wild birds in the trees loudly chirped.
past,controlled,nature,4,standard_subject,ctrl_00348.wav,ctrl_00348,plural,Fowl that migrate crooned.
past,controlled,nature,5,standard_subject_a,ctrl_00349.wav,ctrl_00349,plural,Birds that migrate loudly warbled.
past,controlled,nature,5,standard_subject_b,ctrl_00350.wav,ctrl_00350,plural,Untamed fowl that migrate sang.
past,controlled,nature,6,standard_subject_c,ctrl_00351.wav,ctrl_00351,plural,Wild birds that migrate loudly chanted.
past,controlled,nature,5,standard_object,ctrl_00352.wav,ctrl_00352,plural,Birds that we valued warbled.
past,controlled,nature,6,standard_object_a,ctrl_00353.wav,ctrl_00353,plural,Birds that we esteemed loudly sang.
past,controlled,nature,6,standard_object_b,ctrl_00354.wav,ctrl_00354,plural,Wild birds that we admired sang.
past,controlled,nature,7,standard_object_c,ctrl_00355.wav,ctrl_00355,plural,Wild birds that we admired loudly chanted.
past,controlled,nature,10,nested,ctrl_00356.wav,ctrl_00356,plural,Fowl that soared over the river which flowed rapidly chirped.
past,controlled,nature,11,nested_a,ctrl_00357.wav,ctrl_00357,plural,Fowl that flew over the stream which flowed rapidly loudly chanted.
past,controlled,nature,11,nested_b,ctrl_00358.wav,ctrl_00358,plural,Untamed fowl that flew over the river which flowed quickly sang.
past,controlled,nature,12,nested_c,ctrl_00359.wav,ctrl_00359,plural,Untamed birds that soared over the river which flowed rapidly loudly chanted.
past,controlled,humanity,3,baseline,ctrl_00360.wav,ctrl_00360,plural,Professors instructed students.
past,controlled,humanity,4,baseline_a,ctrl_00361.wav,ctrl_00361,plural,Teachers enthusiastically taught students.
past,controlled,humanity,4,baseline_b,ctrl_00362.wav,ctrl_00362,plural,Dedicated teachers instructed learners.
past,controlled,humanity,5,baseline_c,ctrl_00363.wav,ctrl_00363,plural,Dedicated teachers ardently taught students.
past,controlled,humanity,5,control,ctrl_00364.wav,ctrl_00364,plural,Instructors in institutions educated students.
past,controlled,humanity,6,control_a,ctrl_00365.wav,ctrl_00365,plural,Instructors in academies passionately taught learners.
past,controlled,humanity,6,control_b,ctrl_00366.wav,ctrl_00366,plural,Committed educators in schools taught students.
past,controlled,humanity,7,control_c,ctrl_00367.wav,ctrl_00367,plural,Dedicated teachers in schools fervently taught students.
past,controlled,humanity,6,standard_subject,ctrl_00368.wav,ctrl_00368,plural,Instructors who labored hard taught students.
past,controlled,humanity,7,standard_subject_a,ctrl_00369.wav,ctrl_00369,plural,Educators who labored hard ardently instructed students.
past,controlled,humanity,7,standard_subject_b,ctrl_00370.wav,ctrl_00370,plural,Committed teachers who worked diligently educated pupils.
past,controlled,humanity,8,standard_subject_c,ctrl_00371.wav,ctrl_00371,plural,Dedicated instructors who worked hard fervently taught students.
past,controlled,humanity,6,standard_object,ctrl_00372.wav,ctrl_00372,plural,Teachers that children respected taught students.
past,controlled,humanity,7,standard_object_a,ctrl_00373.wav,ctrl_00373,plural,Professors that kids respected passionately instructed learners.
past,controlled,humanity,7,standard_object_b,ctrl_00374.wav,ctrl_00374,plural,Dedicated mentors that kids admired instructed pupils.
past,controlled,humanity,8,standard_object_c,ctrl_00375.wav,ctrl_00375,plural,Dedicated teachers that children admired passionately instructed students.
past,controlled,humanity,10,nested,ctrl_00376.wav,ctrl_00376,plural,Teachers who read the materials that were applicable instructed students.
past,controlled,humanity,11,nested_a,ctrl_00377.wav,ctrl_00377,plural,Teachers who read the resources that were pertinent passionately taught learners.
past,controlled,humanity,11,nested_b,ctrl_00378.wav,ctrl_00378,plural,Dedicated teachers who read the materials that were relevant taught students.
past,controlled,humanity,12,nested_c,ctrl_00379.wav,ctrl_00379,plural,Committed instructors who read the resources that were relevant passionately educated learners.
present,controlled,sport,5,baseline,ctrl_00380.wav,ctrl_00380,singular,The sportsman claims the prize.
present,controlled,sport,6,baseline_a,ctrl_00381.wav,ctrl_00381,singular,The competitor easily earns the award.
present,controlled,sport,6,baseline_b,ctrl_00382.wav,ctrl_00382,singular,The steadfast athlete wins the trophy.
present,controlled,sport,7,baseline_c,ctrl_00383.wav,ctrl_00383,singular,The steadfast sportsman effortlessly secures the award.
present,controlled,sport,8,control,ctrl_00384.wav,ctrl_00384,singular,The competitor in the competition earns the award.
present,controlled,sport,9,control_a,ctrl_00385.wav,ctrl_00385,singular,The competitor in the contest easily obtains the trophy.
present,controlled,sport,9,control_b,ctrl_00386.wav,ctrl_00386,singular,The determined athlete in the competition earns the prize.
present,controlled,sport,10,control_c,ctrl_00387.wav,ctrl_00387,singular,The resolute sportsman in the competition easily secures the trophy.
present,controlled,sport,8,standard_subject,ctrl_00388.wav,ctrl_00388,singular,The competitor who prepares intensely triumphs the award.
present,controlled,sport,9,standard_subject_a,ctrl_00389.wav,ctrl_00389,singular,The competitor who trains intensely easily triumphs the trophy.
present,controlled,sport,9,standard_subject_b,ctrl_00390.wav,ctrl_00390,singular,The resolute athlete who trains hard wins the trophy.
present,controlled,sport,10,standard_subject_c,ctrl_00391.wav,ctrl_00391,singular,The resolved competitor who trains hard effortlessly secures the trophy.
present,controlled,sport,8,standard_object,ctrl_00392.wav,ctrl_00392,singular,The sportsman that everyone respects secures the prize.
present,controlled,sport,9,standard_object_a,ctrl_00393.wav,ctrl_00393,singular,The competitor that everyone respects easily secures the trophy.
present,controlled,sport,9,standard_object_b,ctrl_00394.wav,ctrl_00394,singular,The resolved athlete that everyone respects earns the prize.
present,controlled,sport,10,standard_object_c,ctrl_00395.wav,ctrl_00395,singular,The determined athlete that everyone admires easily secures the trophy.
present,controlled,sport,12,nested,ctrl_00396.wav,ctrl_00396,singular,The sportsperson who met the coach that inspires them wins the trophy.
present,controlled,sport,13,nested_a,ctrl_00397.wav,ctrl_00397,singular,The runner who saw the instructor that motivates them easily wins the trophy.
present,controlled,sport,13,nested_b,ctrl_00398.wav,ctrl_00398,singular,The determined athlete who met the coach that inspires them wins the trophy.
present,controlled,sport,14,nested_c,ctrl_00399.wav,ctrl_00399,singular,The determined competitor who met the instructor that encourages them easily gains the prize.
past,controlled,sport,5,baseline,ctrl_00400.wav,ctrl_00400,plural,The athletes ran the contest.
past,controlled,sport,6,baseline_a,ctrl_00401.wav,ctrl_00401,plural,The runners quickly sprinted the race.
past,controlled,sport,6,baseline_b,ctrl_00402.wav,ctrl_00402,plural,The resolute runners sprinted the race.
past,controlled,sport,7,baseline_c,ctrl_00403.wav,ctrl_00403,plural,The resolute athletes swiftly sprinted the race.
past,controlled,sport,7,control,ctrl_00404.wav,ctrl_00404,plural,Competitors from the city sprinted the event.
past,controlled,sport,8,control_a,ctrl_00405.wav,ctrl_00405,plural,Competitors from the town fast sprinted the race.
past,controlled,sport,8,control_b,ctrl_00406.wav,ctrl_00406,plural,Determined sportspeople from the city ran the race.
past,controlled,sport,9,control_c,ctrl_00407.wav,ctrl_00407,plural,Resolute sportspeople from the city swiftly sprinted the race.
past,controlled,sport,7,standard_subject,ctrl_00408.wav,ctrl_00408,plural,Athletes who trained intensely ran the race.
past,controlled,sport,8,standard_subject_a,ctrl_00409.wav,ctrl_00409,plural,Competitors who trained hard quickly ran the contest.
past,controlled,sport,8,standard_subject_b,ctrl_00410.wav,ctrl_00410,plural,Resolute competitors who prepared hard sprinted the contest.
past,controlled,sport,9,standard_subject_c,ctrl_00411.wav,ctrl_00411,plural,Resolute athletes who trained hard quickly ran the race.
past,controlled,sport,7,standard_object,ctrl_00412.wav,ctrl_00412,plural,Athletes that everyone esteemed ran the race.
past,controlled,sport,8,standard_object_a,ctrl_00413.wav,ctrl_00413,plural,Players that everyone admired promptly sprinted the race.
past,controlled,sport,8,standard_object_b,ctrl_00414.wav,ctrl_00414,plural,Determined athletes that everyone respected ran the race.
past,controlled,sport,9,standard_object_c,ctrl_00415.wav,ctrl_00415,plural,Determined athletes that everyone admired quickly ran the race.
past,controlled,sport,12,nested,ctrl_00416.wav,ctrl_00416,plural,Players who knew the coach that guided the group sprinted the race.
past,controlled,sport,13,nested_a,ctrl_00417.wav,ctrl_00417,plural,Competitors who knew the trainer that led the squad speedily ran the race.
past,controlled,sport,13,nested_b,ctrl_00418.wav,ctrl_00418,plural,Steadfast athletes who knew the trainer that led the team ran the race.
past,controlled,sport,14,nested_c,ctrl_00419.wav,ctrl_00419,plural,Resolved athletes who understood the coach that led the squad swiftly sprinted the competition.
past,controlled,work,3,baseline,ctrl_00420.wav,ctrl_00420,plural,Learners attended presentations.
past,controlled,work,4,baseline_a,ctrl_00421.wav,ctrl_00421,plural,Learners eagerly attended presentations.
past,controlled,work,4,baseline_b,ctrl_00422.wav,ctrl_00422,plural,Diligent learners joined lectures.
past,controlled,work,5,baseline_c,ctrl_00423.wav,ctrl_00423,plural,Industrious pupils enthusiastically participated lectures.
past,controlled,work,6,control,ctrl_00424.wav,ctrl_00424,plural,Students in the library joined lectures.
past,controlled,work,7,control_a,ctrl_00425.wav,ctrl_00425,plural,Students in the library avidly visited talks.
past,controlled,work,7,control_b,ctrl_00426.wav,ctrl_00426,plural,Hardworking learners in the library joined lectures.
past,controlled,work,8,control_c,ctrl_00427.wav,ctrl_00427,plural,Meticulous scholars in the library avidly attended lectures.
past,controlled,work,6,standard_subject,ctrl_00428.wav,ctrl_00428,plural,Students who studied hard went to seminars.
past,controlled,work,7,standard_subject_a,ctrl_00429.wav,ctrl_00429,plural,Pupils who studied hard enthusiastically joined lectures.
past,controlled,work,7,standard_subject_b,ctrl_00430.wav,ctrl_00430,plural,Diligent students who studied hard attended lectures.
past,controlled,work,8,standard_subject_c,ctrl_00431.wav,ctrl_00431,plural,Diligent learners who studied hard eagerly attended classes.
past,controlled,work,6,standard_object,ctrl_00432.wav,ctrl_00432,plural,Pupils that professors recommended attended lectures.
past,controlled,work,7,standard_object_a,ctrl_00433.wav,ctrl_00433,plural,Pupils that professors recommended eagerly attended lectures.
past,controlled,work,7,standard_object_b,ctrl_00434.wav,ctrl_00434,plural,Diligent learners that professors recommended visited lectures.
past,controlled,work,8,standard_object_c,ctrl_00435.wav,ctrl_00435,plural,Industrious learners that professors endorsed keenly participated lectures.
past,controlled,work,10,nested,ctrl_00436.wav,ctrl_00436,plural,Learners who composed papers that amazed the teacher attended lectures.
past,controlled,work,11,nested_a,ctrl_00437.wav,ctrl_00437,plural,Pupils who wrote papers that astonished the instructor eagerly attended lectures.
past,controlled,work,11,nested_b,ctrl_00438.wav,ctrl_00438,plural,Diligent pupils who composed compositions that impressed the educator visited talks.
past,controlled,work,12,nested_c,ctrl_00439.wav,ctrl_00439,plural,Hardworking learners who wrote essays that impressed the teacher eagerly attended lectures.
past,controlled,transport,2,baseline,ctrl_00440.wav,ctrl_00440,plural,Buses ceased.
past,controlled,transport,3,baseline_a,ctrl_00441.wav,ctrl_00441,plural,Buses suddenly ceased.
past,controlled,transport,3,baseline_b,ctrl_00442.wav,ctrl_00442,plural,Large buses stopped.
past,controlled,transport,4,baseline_c,ctrl_00443.wav,ctrl_00443,plural,Large coaches abruptly stopped.
past,controlled,transport,5,control,ctrl_00444.wav,ctrl_00444,plural,Buses on the route stopped.
past,controlled,transport,6,control_a,ctrl_00445.wav,ctrl_00445,plural,Buses on the route suddenly stopped.
past,controlled,transport,6,control_b,ctrl_00446.wav,ctrl_00446,plural,Large buses on the route stopped.
past,controlled,transport,7,control_c,ctrl_00447.wav,ctrl_00447,plural,Large buses on the route suddenly stopped.
past,controlled,transport,5,standard_subject,ctrl_00448.wav,ctrl_00448,plural,Coaches that ran regularly ceased.
past,controlled,transport,6,standard_subject_a,ctrl_00449.wav,ctrl_00449,plural,Buses that ran regularly suddenly stopped.
past,controlled,transport,6,standard_subject_b,ctrl_00450.wav,ctrl_00450,plural,Big buses that ran regularly stopped.
past,controlled,transport,7,standard_subject_c,ctrl_00451.wav,ctrl_00451,plural,Large buses that ran daily abruptly stopped.
past,controlled,transport,5,standard_object,ctrl_00452.wav,ctrl_00452,plural,Buses which commuters used stopped.
past,controlled,transport,6,standard_object_a,ctrl_00453.wav,ctrl_00453,plural,Buses which travelers used suddenly stopped.
past,controlled,transport,6,standard_object_b,ctrl_00454.wav,ctrl_00454,plural,Large buses which commuters used stopped.
past,controlled,transport,7,standard_object_c,ctrl_00455.wav,ctrl_00455,plural,Big buses which commuters used suddenly stopped.
past,controlled,transport,8,nested,ctrl_00456.wav,ctrl_00456,plural,Coaches that transported riders who worked downtown stopped.
past,controlled,transport,9,nested_a,ctrl_00457.wav,ctrl_00457,plural,Buses that transported passengers who worked downtown suddenly halted.
past,controlled,transport,9,nested_b,ctrl_00458.wav,ctrl_00458,plural,Big buses that transported passengers who worked downtown stopped.
past,controlled,transport,10,nested_c,ctrl_00459.wav,ctrl_00459,plural,Large coaches that transported passengers who worked downtown suddenly ceased.
past,controlled,nature,3,baseline,ctrl_00460.wav,ctrl_00460,singular,The stream flows.
past,controlled,nature,4,baseline_a,ctrl_00461.wav,ctrl_00461,singular,The river consistently flows.
past,controlled,nature,4,baseline_b,ctrl_00462.wav,ctrl_00462,singular,The long river flows.
past,controlled,nature,5,baseline_c,ctrl_00463.wav,ctrl_00463,singular,The long stream steadily flows.
past,controlled,nature,6,control,ctrl_00464.wav,ctrl_00464,singular,The river in the valley runs.
past,controlled,nature,7,control_a,ctrl_00465.wav,ctrl_00465,singular,The stream in the valley continuously flows.
past,controlled,nature,7,control_b,ctrl_00466.wav,ctrl_00466,singular,The long river in the valley flows.
past,controlled,nature,8,control_c,ctrl_00467.wav,ctrl_00467,singular,The long river in the valley steadily courses.
past,controlled,nature,6,standard_subject,ctrl_00468.wav,ctrl_00468,singular,The river that I visited flows.
past,controlled,nature,7,standard_subject_a,ctrl_00469.wav,ctrl_00469,singular,The river that I toured steadily flows.
past,controlled,nature,7,standard_subject_b,ctrl_00470.wav,ctrl_00470,singular,The long river that I visited flows.
past,controlled,nature,8,standard_subject_c,ctrl_00471.wav,ctrl_00471,singular,The long river that I traveled consistently flows.
past,controlled,nature,6,standard_object,ctrl_00472.wav,ctrl_00472,singular,The river that visitors love flows.
past,controlled,nature,7,standard_object_a,ctrl_00473.wav,ctrl_00473,singular,The river that visitors love steadily flows.
past,controlled,nature,7,standard_object_b,ctrl_00474.wav,ctrl_00474,singular,The long river that tourists love flows.
past,controlled,nature,8,standard_object_c,ctrl_00475.wav,ctrl_00475,singular,The long river that tourists love steadily flows.
past,controlled,nature,10,nested,ctrl_00476.wav,ctrl_00476,singular,The stream that has the fish that I study flows.
past,controlled,nature,11,nested_a,ctrl_00477.wav,ctrl_00477,singular,The river that has the fish that I study consistently flows.
past,controlled,nature,11,nested_b,ctrl_00478.wav,ctrl_00478,singular,The long stream that has the fish that I study runs.
past,controlled,nature,12,nested_c,ctrl_00479.wav,ctrl_00479,singular,The long river that has the fish that I study steadily flows.
present,controlled,shopping,5,baseline,ctrl_00480.wav,ctrl_00480,singular,The buyer acquires the blouse.
present,controlled,shopping,6,baseline_a,ctrl_00481.wav,ctrl_00481,singular,The buyer keenly acquires the shirt.
present,controlled,shopping,6,baseline_b,ctrl_00482.wav,ctrl_00482,singular,The joyful customer buys the shirt.
present,controlled,shopping,7,baseline_c,ctrl_00483.wav,ctrl_00483,singular,The joyful buyer keenly acquires the top.
present,controlled,shopping,8,control,ctrl_00484.wav,ctrl_00484,singular,The customer in the shop acquires the top.
present,controlled,shopping,9,control_a,ctrl_00485.wav,ctrl_00485,singular,The buyer in the shop eagerly buys the blouse.
present,controlled,shopping,9,control_b,ctrl_00486.wav,ctrl_00486,singular,The pleased shopper in the shop purchases the blouse.
present,controlled,shopping,10,control_c,ctrl_00487.wav,ctrl_00487,singular,The happy buyer in the store keenly purchases the top.
present,controlled,shopping,8,standard_subject,ctrl_00488.wav,ctrl_00488,singular,The client who peruses daily purchases the shirt.
present,controlled,shopping,9,standard_subject_a,ctrl_00489.wav,ctrl_00489,singular,The customer who browses regularly enthusiastically buys the top.
present,controlled,shopping,9,standard_subject_b,ctrl_00490.wav,ctrl_00490,singular,The content customer who peruses daily buys the top.
present,controlled,shopping,10,standard_subject_c,ctrl_00491.wav,ctrl_00491,singular,The happy buyer who browses daily keenly buys the top.
present,controlled,shopping,8,standard_object,ctrl_00492.wav,ctrl_00492,singular,The customer that loves bargains buys the top.
present,controlled,shopping,9,standard_object_a,ctrl_00493.wav,ctrl_00493,singular,The client that loves bargains eagerly buys the shirt.
present,controlled,shopping,9,standard_object_b,ctrl_00494.wav,ctrl_00494,singular,The happy customer that loves deals buys the shirt.
present,controlled,shopping,10,standard_object_c,ctrl_00495.wav,ctrl_00495,singular,The joyful buyer that loves bargains eagerly buys the shirt.
present,controlled,shopping,12,nested,ctrl_00496.wav,ctrl_00496,singular,The client who saw the deal that was online purchases the shirt.
present,controlled,shopping,13,nested_a,ctrl_00497.wav,ctrl_00497,singular,The customer who saw the offer that was online eagerly buys the shirt.
present,controlled,shopping,13,nested_b,ctrl_00498.wav,ctrl_00498,singular,The pleased client who noticed the proposal that was online buys the shirt.
